id,name,description,priority,status,estimated_duration,required_capabilities,assigned_worker,created_at,started_at,completed_at,progress,subtasks,dependencies,metadata,implementation_notes,last_updated
todo_001,Implement Docker Compose Production Configuration,Implement Docker Compose Production Configuration - 6 hours - Phase 3 - Deployment,high,pending,4,"[""deployment"", ""devops"", ""infrastructure"", ""docker"", ""containerization"", ""devops""]",,2025-08-23T14:55:49.320336,,,0.0,[],[],"{""type"": ""new_todo"", ""source"": ""manual_add"", ""created_by"": ""system""}",[],2025-08-23T14:55:49.320340
todo_002,Implement Kubernetes Deployment Manifests,Implement Kubernetes Deployment Manifests - 8 hours - Phase 3 - Deployment,high,pending,6,"[""deployment"", ""devops"", ""infrastructure"", ""kubernetes"", ""orchestration"", ""devops""]",,2025-08-23T14:55:49.323009,,,0.0,[],[],"{""type"": ""new_todo"", ""source"": ""manual_add"", ""created_by"": ""system""}",[],2025-08-23T14:55:49.323013
todo_003,Implement API Gateway Production Configuration,Implement API Gateway Production Configuration - 6 hours - Phase 3 - Deployment,high,pending,4,"[""deployment"", ""devops"", ""infrastructure"", ""api_development"", ""backend"", ""integration""]",,2025-08-23T14:55:49.325013,,,0.0,[],[],"{""type"": ""new_todo"", ""source"": ""manual_add"", ""created_by"": ""system""}",[],2025-08-23T14:55:49.325018
todo_004,Implement Database Migration and Seeding Scripts,Implement Database Migration and Seeding Scripts - 5 hours - Phase 3 - Deployment,high,pending,3,"[""deployment"", ""devops"", ""infrastructure"", ""database"", ""data_management"", ""backend""]",,2025-08-23T14:55:49.327184,,,0.0,[],[],"{""type"": ""new_todo"", ""source"": ""manual_add"", ""created_by"": ""system""}",[],2025-08-23T14:55:49.327188
todo_005,Implement Health Check and Monitoring Endpoints,Implement Health Check and Monitoring Endpoints - 4 hours - Phase 3 - Deployment,high,pending,2,"[""deployment"", ""devops"", ""infrastructure"", ""monitoring"", ""observability"", ""devops""]",,2025-08-23T14:55:49.329195,,,0.0,[],[],"{""type"": ""new_todo"", ""source"": ""manual_add"", ""created_by"": ""system""}",[],2025-08-23T14:55:49.329198
